{"$defs":{"BinaryWireV1":{"additionalProperties":false,"properties":{"byte_length":{"format":"uint64","minimum":0,"type":"integer"},"data":{"type":"string"},"encoding":{"type":"string"}},"required":["encoding","data","byte_length"],"type":"object"},"EventWire":{"additionalProperties":false,"properties":{"authorized_bytes":{"$ref":"#/$defs/BinaryWireV1"},"event_id":{"type":"string"},"exactness":{"type":"string"},"stream":{"type":"string"}},"required":["event_id","exactness","stream","authorized_bytes"],"type":"object"},"PacketWire":{"additionalProperties":false,"properties":{"allowed_relations":{"items":{"type":"string"},"type":"array"},"event_ids":{"items":{"type":"string"},"type":"array"},"events":{"items":{"$ref":"#/$defs/EventWire"},"type":"array"},"evidence_reference_id":{"type":"string"},"expires_at_unix_nanos":{"type":"string"},"issued_at_unix_nanos":{"type":"string"},"ordinal":{"format":"uint64","minimum":0,"type":"integer"},"reference_result_id":{"type":"string"}},"required":["ordinal","evidence_reference_id","reference_result_id","allowed_relations","issued_at_unix_nanos","expires_at_unix_nanos","event_ids","events"],"type":"object"},"StructuredWire":{"additionalProperties":false,"properties":{"accounted_token_upper_bound":{"format":"uint64","minimum":0,"type":"integer"},"acknowledged_records":{"format":"uint64","minimum":0,"type":"integer"},"acquisition_receipt_id":{"type":"string"},"acquisition_state":{"type":"string"},"evidence":{"items":{"$ref":"#/$defs/PacketWire"},"type":"array"},"needs_more_reason":{"type":["string","null"]},"omitted_by_policy_records":{"format":"uint64","minimum":0,"type":"integer"},"pattern_represented":{"format":"uint64","minimum":0,"type":"integer"},"plan_digest":{"type":"string"},"post_policy_records":{"format":"uint64","minimum":0,"type":"integer"},"presentation_receipt_id":{"type":"string"},"question_digest":{"type":"string"},"reference_authorized_at_unix_nanos":{"type":"string"},"result_id":{"type":"string"},"retained_raw":{"format":"uint64","minimum":0,"type":"integer"},"selection_state":{"type":"string"},"shown_verbatim":{"format":"uint64","minimum":0,"type":"integer"},"source_exact_records":{"format":"uint64","minimum":0,"type":"integer"},"total_token_limit":{"format":"uint64","minimum":0,"type":"integer"},"untrusted_data":{"type":"boolean"}},"required":["result_id","question_digest","plan_digest","reference_authorized_at_unix_nanos","untrusted_data","acquisition_state","selection_state","acquisition_receipt_id","presentation_receipt_id","acknowledged_records","source_exact_records","post_policy_records","omitted_by_policy_records","shown_verbatim","pattern_represented","retained_raw","total_token_limit","accounted_token_upper_bound","evidence"],"type":"object"}},"$id":"schemas/evidentrail/v1/log_brief.schema.json","$schema":"https://json-schema.org/draft/2020-12/schema","additionalProperties":false,"properties":{"contract":{"const":"evidentrail.log_brief","type":"string"},"contract_version":{"const":1,"format":"uint16","maximum":9007199254740991,"minimum":0,"type":"integer"},"rendered_byte_count":{"format":"uint64","maximum":9007199254740991,"minimum":0,"type":"integer"},"rendered_text":{"type":"string"},"rendered_token_count":{"format":"uint64","maximum":9007199254740991,"minimum":0,"type":"integer"},"renderer_digest":{"pattern":"^artifact_sha256_[0-9a-f]{64}$","type":"string"},"structured":{"$ref":"#/$defs/StructuredWire"},"tokenizer_digest":{"pattern":"^artifact_sha256_[0-9a-f]{64}$","type":"string"},"variant":{"type":"string"}},"required":["contract","contract_version","variant","structured","rendered_text","rendered_byte_count","rendered_token_count","renderer_digest","tokenizer_digest"],"title":"evidentrail.log_brief","type":"object"}