{"contract":"evidentrail.log_brief","contract_version":1,"rendered_byte_count":0,"rendered_text":"","rendered_token_count":0,"renderer_digest":"artifact_sha256_0000000000000000000000000000000000000000000000000000000000000000","structured":{"accounted_token_upper_bound":0,"acknowledged_records":0,"acquisition_receipt_id":"acqrcpt_0000000000000000000000000000000000000000000000000000000000000000","acquisition_state":"complete","evidence":[],"needs_more_reason":"question_unsupported","omitted_by_policy_records":0,"pattern_represented":0,"plan_digest":"plan_sha256_0000000000000000000000000000000000000000000000000000000000000000","post_policy_records":0,"presentation_receipt_id":"prcpt_0000000000000000000000000000000000000000000000000000000000000000","question_digest":"question_sha256_0000000000000000000000000000000000000000000000000000000000000000","reference_authorized_at_unix_nanos":"0","result_id":"result_0000000000000000000000000000000000000000000000000000000000000000","retained_raw":0,"selection_state":"needs_more","shown_verbatim":0,"source_exact_records":0,"total_token_limit":0,"untrusted_data":true},"tokenizer_digest":"artifact_sha256_0000000000000000000000000000000000000000000000000000000000000000","variant":"needs_more"}